{
  "$schema": "https://json-schema.org/draft/2020-12/schema",
  "title": "Medication data export v1",
  "type": "object",
  "additionalProperties": false,
  "required": ["schema_version", "generated_at", "medication_set", "event_set"],
  "properties": {
    "schema_version": {
      "$ref": "common.schema.json#/$defs/schemaVersion"
    },
    "generated_at": {
      "$ref": "common.schema.json#/$defs/timestamp"
    },
    "medication_set": {
      "$ref": "medication-set.schema.json"
    },
    "event_set": {
      "$ref": "medication-event-set.schema.json"
    }
  }
}
